{
  "schema_version": 1,
  "contract_id": "thailand-priority-guides-v1",
  "site": {
    "origin": "https://thai-land.co.il",
    "locale": "he-IL",
    "direction": "rtl",
    "name": "Thai-Land.co.il"
  },
  "body_contract": {
    "mode": "full_replacement",
    "content_source": "compiled_priority_guides_registry",
    "stored_wordpress_body": "untouched",
    "wordpress_content_filter": "not_called",
    "public_punctuation_policy": "replace_long_dashes_with_hyphen"
  },
  "asset_contract": {
    "directory": "assets/guides/images",
    "filename_pattern": "{asset_key}-{width}.webp",
    "format": "webp",
    "widths": [720, 1200, 1717],
    "allowed_asset_keys": [
      "visas-entry-thailand-v1",
      "cannabis-law-thailand-v1"
    ],
    "readiness": "all_variants_required"
  },
  "parent_catalog": [
    {
      "owner_id": "home",
      "label": "תאילנד לישראלים",
      "primary_keyword": "תאילנד",
      "path": "/",
      "availability": "live"
    },
    {
      "owner_id": "thailand-visas",
      "label": "ויזות וכניסה לתאילנד",
      "primary_keyword": "ויזות לתאילנד",
      "path": "/ויזות-לתאילנד/",
      "availability": "live"
    },
    {
      "owner_id": "thailand-law-and-tax",
      "label": "חוקים ומסים בתאילנד",
      "primary_keyword": "חוקים בתאילנד לישראלים",
      "path": "/חוקים-ומסים-בתאילנד/",
      "availability": "live"
    }
  ],
  "source_catalog": [
    {
      "source_id": "thai-embassy-israel-visa-exemption",
      "label": "פטור מאשרה לבעלי דרכון ישראלי",
      "publisher": "שגרירות תאילנד בישראל",
      "url": "https://telaviv.thaiembassy.org/en/content/visa-exemption-60-days?cate=5d7513dd15e39c3598006af6",
      "scope": "משך השהייה בפטור מאשרה והאפשרות לבקש הארכה",
      "checked_on": "2026-08-10"
    },
    {
      "source_id": "thai-mfa-visa-change-2026",
      "label": "שינויי הפטור מאשרה שאושרו וממתינים לפרסום",
      "publisher": "משרד החוץ של תאילנד",
      "url": "https://consular.mfa.go.th/th/content/20-5-69-0000?menu=5d68c88b15e39c160c008175&page=5d68c88b15e39c160c008173",
      "scope": "המעבר המתוכנן ממסלול של 60 יום למסלולי פטור חדשים ומועד התחילה המשפטי",
      "checked_on": "2026-08-10"
    },
    {
      "source_id": "thai-immigration-tdac",
      "label": "Thailand Digital Arrival Card",
      "publisher": "לשכת ההגירה של תאילנד",
      "url": "https://tdac.immigration.go.th/manual/en/",
      "scope": "מי חייב למלא TDAC, חלון ההגשה והפרטים הנדרשים",
      "checked_on": "2026-08-10"
    },
    {
      "source_id": "tat-proof-of-funds-2026",
      "label": "הוכחת אמצעים כספיים בביקורת הגבולות",
      "publisher": "רשות התיירות של תאילנד",
      "url": "https://www.tatnews.org/2026/07/thailand-entry-reminder-on-proof-of-funds-for-foreign-visitors/",
      "scope": "סכומי הייחוס לפי מסלול הכניסה וסמכות פקיד ההגירה",
      "checked_on": "2026-08-10"
    },
    {
      "source_id": "thai-evisa-official",
      "label": "האתר הרשמי להגשת בקשת e-Visa",
      "publisher": "משרד החוץ של תאילנד",
      "url": "https://thaievisa.go.th/",
      "scope": "בדיקת זכאות, בחירת סוג אשרה והגשה מקוונת מחוץ לתאילנד",
      "checked_on": "2026-08-10"
    },
    {
      "source_id": "thai-embassy-israel-evisa",
      "label": "הגשת e-Visa מישראל",
      "publisher": "שגרירות תאילנד בישראל",
      "url": "https://telaviv.thaiembassy.org/en/content/announcement-on-the-launch-of-online-e-visa",
      "scope": "ההליך החל על מבקשי אשרה השוהים בישראל",
      "checked_on": "2026-08-10"
    },
    {
      "source_id": "thai-mfa-tourist-visa",
      "label": "אשרת תייר TR",
      "publisher": "המחלקה לעניינים קונסולריים של תאילנד",
      "url": "https://consular.mfa.go.th/th/publicservice/%E0%B8%99%E0%B8%B1%E0%B8%81%E0%B8%97%E0%B9%88%E0%B8%AD%E0%B8%87%E0%B9%80%E0%B8%97%E0%B8%B5%E0%B9%88%E0%B8%A2%E0%B8%A7-tourist-visa?menu=5ddcb8b29b1e8a30447d6f22&page=5ddcb94a01330918812bbf22",
      "scope": "מטרת האשרה, תוקף, שהייה, מסמכים, אמצעים כספיים ותעריפי בסיס",
      "checked_on": "2026-08-10"
    },
    {
      "source_id": "thai-immigration-pr-criteria",
      "label": "הנחיות לבקשת תושבות קבע במכסה שנתית",
      "publisher": "הפורטל הממשלתי של תאילנד",
      "url": "https://thailand.go.th/issue-focus-detail/001_01_150",
      "scope": "תנאי שהייה, מסלולי הבקשה, ראיון, בדיקות רקע ואגרות",
      "checked_on": "2026-08-10"
    },
    {
      "source_id": "thai-immigration-pr-2025-window",
      "label": "חלון בקשות התושבות למכסת 2025",
      "publisher": "לשכת ההגירה של תאילנד",
      "url": "https://phetchabun.immigration.go.th/%E0%B8%9B%E0%B8%A3%E0%B8%B0%E0%B8%81%E0%B8%B2%E0%B8%A8-%E0%B9%80%E0%B8%A3%E0%B8%B7%E0%B9%88%E0%B8%AD%E0%B8%87-%E0%B8%81%E0%B8%B2%E0%B8%A3%E0%B9%80%E0%B8%9B%E0%B8%B4%E0%B8%94%E0%B8%A3%E0%B8%B1%E0%B8%9A/",
      "scope": "מועד ההגשה האחרון שפורסם לבקשות תושבות קבע",
      "checked_on": "2026-08-10"
    },
    {
      "source_id": "thai-immigration-pr-documents",
      "label": "מסמכים לבקשת תושבות קבע",
      "publisher": "הפורטל הממשלתי של תאילנד",
      "url": "https://thailand.go.th/issue-focus-detail/applying-for-thailand-permanent-residency-pr-visa?hl=en",
      "scope": "דרכון, מעמד Non-Immigrant, מסמכי בריאות, מס, עבודה, חברה ומשפחה",
      "checked_on": "2026-08-10"
    },
    {
      "source_id": "thai-government-cannabis-tourists",
      "label": "כללי קנאביס לתיירים",
      "publisher": "ממשלת תאילנד",
      "url": "https://www.thailand.go.th/public/issue-focus-detail/cannabis-now-strictly-regulated-in-thailand--important-notice-for-tourists",
      "scope": "מעמד תפרחת קנאביס, מרשם תאילנדי, כמות טיפול ואיסורי מכירה",
      "checked_on": "2026-08-10"
    },
    {
      "source_id": "thai-prd-cannabis-medical",
      "label": "אכיפת כללי הקנאביס הרפואי ב-2026",
      "publisher": "מחלקת יחסי הציבור של ממשלת תאילנד",
      "url": "https://www.prd.go.th/th/content/category/detail/id/2940/iid/514554",
      "scope": "אכיפת רישוי חנויות והמדיניות נגד שימוש פנאי",
      "checked_on": "2026-08-10"
    },
    {
      "source_id": "thai-mfa-entry-april-2022",
      "label": "כללי הכניסה החל מ-1 באפריל 2022",
      "publisher": "משרד החוץ של תאילנד",
      "url": "https://www.mfa.go.th/en/content/entry-measures-1-apr-2022?cate=5f069ee372a783584326eb24",
      "scope": "ביטול בדיקת RT-PCR לפני הטיסה במסגרת כללי אפריל 2022",
      "checked_on": "2026-08-10"
    },
    {
      "source_id": "tat-full-reopen-october-2022",
      "label": "הפתיחה המלאה באוקטובר 2022",
      "publisher": "רשות התיירות של תאילנד",
      "url": "https://www.tatnews.org/2022/10/thailand-fully-reopens-from-1-october-2022/",
      "scope": "סיום דרישות החיסון והבדיקות והחזרה לכללי כניסה רגילים",
      "checked_on": "2026-08-10"
    },
    {
      "source_id": "thai-revenue-personal-income-tax",
      "label": "מס הכנסה אישי בתאילנד",
      "publisher": "רשות המסים של תאילנד",
      "url": "https://www.rd.go.th/english/6045.html",
      "scope": "תושבות מס, הכנסה ממקור תאילנדי, הכנסה מחוץ לתאילנד ומועד הגשת הדוח",
      "checked_on": "2026-08-10"
    },
    {
      "source_id": "thai-revenue-code-section-41",
      "label": "פקודת המס של תאילנד, סעיף 41",
      "publisher": "רשות המסים של תאילנד",
      "url": "https://www.rd.go.th/english/37749.html",
      "scope": "הגדרת תושב מס לפי שהייה מצטברת של 180 ימים או יותר בשנת מס",
      "checked_on": "2026-08-10"
    },
    {
      "source_id": "thai-boi-business-guide",
      "label": "מדריך לעסקים ולהשקעות בתאילנד",
      "publisher": "מועצת ההשקעות של תאילנד",
      "url": "https://www.boi.go.th/upload/content/A_Business_Guide_to_Thailand.pdf",
      "scope": "מבנה חוק העסקים לזרים, פעילויות מוגבלות, רישיונות ומסלולי השקעה",
      "checked_on": "2026-08-10"
    },
    {
      "source_id": "thai-department-employment-eworkpermit",
      "label": "מערכת היתר העבודה האלקטרוני",
      "publisher": "משרד התעסוקה של תאילנד",
      "url": "https://eworkpermit.doe.go.th/Home",
      "scope": "הגשת בקשות והליכים מקוונים להיתרי עבודה לעובדים זרים",
      "checked_on": "2026-08-10"
    },
    {
      "source_id": "thai-tourist-police",
      "label": "משטרת התיירות של תאילנד",
      "publisher": "משטרת התיירות של תאילנד",
      "url": "https://www.touristpolice.go.th/main",
      "scope": "מוקד 1155, קבלת סיוע לתיירים ושירותי תרגום במקרי צורך",
      "checked_on": "2026-08-10"
    }
  ],
  "routes": [
    {
      "route_id": "thailand-visas",
      "kind": "collection",
      "seo_owner_id": "thailand-visas",
      "path": "/ויזות-לתאילנד/",
      "parent_owner_id": "home",
      "wordpress": {
        "post_id": 846,
        "post_type": "page",
        "identity_policy": "id_and_path_exact",
        "body_mode": "full_replacement",
        "state_policy": "draft_canary_or_published_live"
      },
      "asset_key": "visas-entry-thailand-v1",
      "ownership": {
        "primary_keyword": "ויזות לתאילנד",
        "synonyms": [
          "סוגי ויזות לתאילנד",
          "אשרות ושהייה בתאילנד"
        ],
        "intent": "לבחור מסלול כניסה או שהייה מתאים לתאילנד ולהבין את הפעולות לפני הטיסה ואחריה"
      },
      "indexing": {
        "policy": "index",
        "follow": true,
        "max_image_preview": "large"
      },
      "freshness": {
        "checked_on": "2026-08-10",
        "next_review_on": "2026-08-17",
        "review_interval_days": 7,
        "historical": false,
        "note": "כללי הכניסה נבדקים בתדירות גבוהה בגלל שינוי הפטור המתוכנן והבדיקות המשתנות בגבול."
      },
      "published_on": "2026-08-10",
      "modified_on": "2026-08-10",
      "public": {
        "kicker": "ויזות, כניסה ושהייה",
        "h1": "ויזות לתאילנד: כניסה, סוגי ויזה ושהייה",
        "seo_title": "ויזות לתאילנד: כניסה, סוגי ויזה ושהייה",
        "meta_description": "ויזות לתאילנד לישראלים: פטור מאשרה, ויזת תייר, eVisa, TDAC, הארכות ותושבות קבע. בחרו את המסלול לפי מטרת הנסיעה ומשך השהייה.",